### ISSUE TITLE
coap response: invalid pointer to sent pdu

### ISSUE THREAD

**Issue by fero29** [obgm/libcoap#389]
I am created response handler function which is called when resp[onse comes. Function have this parameters: 

struct coap_context_t*    context,
coap_session_t *             session,
coap_pdu_t *                  sent,
coap_pdu_t *                  received, 
const coap_tid_t             id

I read recived PDU it is ok. But when I try to read sent PDU, this pointer is NULL. 

I am create Coap_session object and it have this atributes:
    coap_context_t  *m_ctx;
    coap_session_t  *m_session;
    coap_address_t   m_dst;
    coap_pdu_t      *m_pdu;

object is still exist when I try to read sent PDU.

**Comment by mrdeep1** [comment]
It is good that you have decided to try working with libcoap.

`sent `will be NULL if the packet received was an acknowledgement type of CoAP packet, but there is no packet in the (possibly repeat) send queue for this acknowledgement.

I assume that you are working with the latest code in develop branch.

It is worth enabling CoAP logging at the LOG_DEBUG level (see man page on coap_logging(3)) to try to track down what is happening here.

**Comment by fero29** [comment]
but that is not ACK packet type. 
First I sended GET type of packet 
and it comes CONTENT type of packet
than will be send ACK type of packet.

client  ->     GET               ->  server
client <-      CONTENT     <-   server
client ->      ACK               ->   server

I try to read CONTENT packet. 

I use function coap_register_response_handler 

And when coap_response_handler  function is invoke I read data from PDU.
When I read `coap_pdu_t * received` it is ok
but when i read `coap_pdu_t * sent` it point to NULL 

both is parameter of `coap_register_response_handler ` function

**Comment by mrdeep1** [comment]
It is likely that the GET is CONFIRMABLE and so will solicit an ACK response that may or may not contain any data - your CONTENT.  As it is of type CONFIRMABLE, then the receipt of CONTENT (which has data in it) needs to be ACKed to stop the server retransmitting the data (so CoAP can recover if there is packet loss).

I don't understand why your client does not understand your CONTENT packet unless there is a duplicate packet being retransmitted in error.  

Are you using the example CoAP server or one you have made?

Are you trying a multicast connection?

You really do need to enable logging at the LOG_DEBUG level to see what libcoap does not like

**Comment by mrdeep1** [comment]
For further clarification, `received `contains the pointer to the packet received by the client that was sent by the server.  Likewise, `sent` contains the pointer to the packet sent by the client and received by the server.  The only reason for `sent` being NULL is if the client libcoap logic cannot match the `receive` packet with any packet that was sent by the client and not yet acknowledged.

**Comment by fero29** [comment]
I use my own coap server. 

I try use unicast and multicast.

I used LOG_DEBUG there is no error and no suspicious log.

there is LOG

Start thread tcp send                                    
Start thread tcp receive
192.168.1.200 connected on port 57920
clientSocket:  (4)                                                  //tcp comunication
creating session                                                  //create coap session
Aug 19 08:47:19 DEBG ***[fdde:ad00:beef:0:4522:75f4:9ee6:2fec]:43165 <-> [fdde:ad00:beef:0:f15:7fbd:731:c7d4]:5683 UDP : new outgoing session
Aug 19 08:47:19 DEBG *  [fdde:ad00:beef:0:4522:75f4:9ee6:2fec]:43165 <-> [fdde:ad00:beef:0:f15:7fbd:731:c7d4]:5683 UDP : sent 10 bytes
v:1 t:CON c:GET i:0000 {} [ Uri-Path:hello ]
Aug 19 08:47:19 DEBG ** [fdde:ad00:beef:0:4522:75f4:9ee6:2fec]:43165 <-> [fdde:ad00:beef:0:f15:7fbd:731:c7d4]:5683 UDP : tid=0 added to retransmit queue (2406ms)
coap send rq
Aug 19 08:47:19 DEBG *  [fdde:ad00:beef:0:4522:75f4:9ee6:2fec]:43165 <-> [fdde:ad00:beef:0:f15:7fbd:731:c7d4]:5683 UDP : received 4 bytes
v:1 t:CON c:2.05 i:93be {} [ ]
Aug 19 08:47:19 DEBG *  [fdde:ad00:beef:0:4522:75f4:9ee6:2fec]:43165 <-> [fdde:ad00:beef:0:f15:7fbd:731:c7d4]:5683 UDP : sent 4 bytes
v:1 t:ACK c:0.00 i:93be {} [ ]
Aug 19 08:47:19 DEBG ** [fdde:ad00:beef:0:4522:75f4:9ee6:2fec]:43165 <-> [fdde:ad00:beef:0:f15:7fbd:731:c7d4]:5683 UDP : tid=0: removed
v:1 t:CON c:2.05 i:93be {} [ ]
hello //hello packet response handler
remote: fdde:ad00:beef:0:f15:7fbd:731:c7d4  //peer addres (unicast)
invalid pointer to sent pdu                            //check validity of `sent` pointer
coap run ret: 0
dealoc coap session------------------------------------------------------------------
Aug 19 08:47:21 DEBG ***[fdde:ad00:beef:0:4522:75f4:9ee6:2fec]:43165 <-> [fdde:ad00:beef:0:f15:7fbd:731:c7d4]:5683 UDP : session closed

**Comment by mrdeep1** [comment]
Thanks for the log file - it does actually state what is wrong with your CoAP server and the information it is sending which is then confusing your CoAP client.

https://tools.ietf.org/html/rfc7252#section-2.2

> A request is carried in a Confirmable (CON) or Non-confirmable (NON)
> message, and, if immediately available, the response to a request
> carried in a Confirmable message is carried in the resulting
> Acknowledgement (ACK) message

Your log is showing that the response to the request is

> Aug 19 08:47:19 DEBG * [fdde:ad00:beef:0:4522:75f4:9ee6:2fec]:43165 <-> [fdde:ad00:beef:0:f15:7fbd:731:c7d4]:5683 UDP : received 4 bytes
> v:1 **t:CON** c:2.05 i:93be {} [ ]

**t:CON** should actually be **t:ACK** so you need to fix your CoAP Server to respond correctly.

I would suggest that you use either the Server or Client as provided in the libcoap examples and initially only develop the code for the other end and test that it works against the known examples before moving on to doing the interaction of the code between your two specifically coded ends.

.

**Comment by fero29** [comment]
Finaly I get it! I fixed it. 


But it not completely work. 
in first case I request data and server response.
in second case i send hello and server response blank message.

Client is implemented by libcoap and server is implemented as another CoAP library on MCU.    

Start thread tcp send
Start thread tcp receive
192.168.1.200 connected on port 58125
clientSocket:  (4)
creating coap session
Aug 19 10:58:35 DEBG ***[fdde:ad00:beef:0:4522:75f4:9ee6:2fec]:53165 <-> [fdde:ad00:beef:0:f15:7fbd:731:c7d4]:5683 UDP : new outgoing session
Aug 19 10:58:35 DEBG *  [fdde:ad00:beef:0:4522:75f4:9ee6:2fec]:53165 <-> [fdde:ad00:beef:0:f15:7fbd:731:c7d4]:5683 UDP : sent 15 bytes
v:1 t:CON c:GET i:0000 {} [ Uri-Path:read ] :: '\x03\x00\x00\x00\x8C'
Aug 19 10:58:35 DEBG ** [fdde:ad00:beef:0:4522:75f4:9ee6:2fec]:53165 <-> [fdde:ad00:beef:0:f15:7fbd:731:c7d4]:5683 UDP : tid=0 added to retransmit queue (2406ms)
coap send rq
Aug 19 10:58:35 DEBG *  [fdde:ad00:beef:0:4522:75f4:9ee6:2fec]:53165 <-> [fdde:ad00:beef:0:f15:7fbd:731:c7d4]:5683 UDP : received 150 bytes
v:1 t:ACK c:2.05 i:8c00 {038c00} [ ] :: '\x03\x8C\x00\x00Nezadane\x00\x00\x00\x00\x00\x00\x00\x00\x00\x00\x00\x00\x00\x00\x00\x00\x00\x00\x00\x00\x8A\x00\x00\x00s\x17\x01\x00\x00\x00\x00\x10\x0EF\x00F\x00d\x0A\x00x\x052\x00<\x00\x00\x00\x00dX\x02\x00\x00\x00\xE8\x03\x00\x00\x00\x00\xD0\x07\x01\x00\x00\x00\x00\x00\x00P\x00\x00\x00\x00\x00\x00\x00\x00\x00\x00\x00\xB4_\x08Rp\x01\x00\x00\x12\x00\x00\x00\x9F\x11\x00\x00\xF2\xA8\x01\x00\x02\x00\x00\x00\x00\x00\x00\x00\x00\x00\x00\x00\x00\x00\x00\x00\x00\x00\x00\x00\x0C\x00\x00\x00\xF0\xD3^q'
read response handler
v:1 t:ACK c:2.05 i:8c00 {038c00} [ ] :: '\x03\x8C\x00\x00Nezadane\x00\x00\x00\x00\x00\x00\x00\x00\x00\x00\x00\x00\x00\x00\x00\x00\x00\x00\x00\x00\x8A\x00\x00\x00s\x17\x01\x00\x00\x00\x00\x10\x0EF\x00F\x00d\x0A\x00x\x052\x00<\x00\x00\x00\x00dX\x02\x00\x00\x00\xE8\x03\x00\x00\x00\x00\xD0\x07\x01\x00\x00\x00\x00\x00\x00P\x00\x00\x00\x00\x00\x00\x00\x00\x00\x00\x00\xB4_\x08Rp\x01\x00\x00\x12\x00\x00\x00\x9F\x11\x00\x00\xF2\xA8\x01\x00\x02\x00\x00\x00\x00\x00\x00\x00\x00\x00\x00\x00\x00\x00\x00\x00\x00\x00\x00\x00\x0C\x00\x00\x00\xF0\xD3^q'
response size: 143
invalid pointer to sent pdu
coap run ret: 0
dealoc coap session------------------------------------------------------------------
Aug 19 10:58:37 DEBG ***[fdde:ad00:beef:0:4522:75f4:9ee6:2fec]:53165 <-> [fdde:ad00:beef:0:f15:7fbd:731:c7d4]:5683 UDP : session closed










creating session
Aug 19 10:59:10 DEBG ***[fdde:ad00:beef:0:4522:75f4:9ee6:2fec]:54833 <-> [fdde:ad00:beef:0:f15:7fbd:731:c7d4]:5683 UDP : new outgoing session
Aug 19 10:59:10 DEBG *  [fdde:ad00:beef:0:4522:75f4:9ee6:2fec]:54833 <-> [fdde:ad00:beef:0:f15:7fbd:731:c7d4]:5683 UDP : sent 10 bytes
v:1 t:CON c:GET i:0000 {} [ Uri-Path:hello ]
Aug 19 10:59:10 DEBG ** [fdde:ad00:beef:0:4522:75f4:9ee6:2fec]:54833 <-> [fdde:ad00:beef:0:f15:7fbd:731:c7d4]:5683 UDP : tid=0 added to retransmit queue (3000ms)
coap send rq
Aug 19 10:59:10 DEBG *  [fdde:ad00:beef:0:4522:75f4:9ee6:2fec]:54833 <-> [fdde:ad00:beef:0:f15:7fbd:731:c7d4]:5683 UDP : received 4 bytes
v:1 t:ACK c:2.05 i:0000 {} [ ]
Aug 19 10:59:10 DEBG ** [fdde:ad00:beef:0:4522:75f4:9ee6:2fec]:54833 <-> [fdde:ad00:beef:0:f15:7fbd:731:c7d4]:5683 UDP : tid=0: removed
v:1 t:ACK c:2.05 i:0000 {} [ ]
hello
remote: fdde:ad00:beef:0:f15:7fbd:731:c7d4
pointer to sent is valid
coap run ret: 0
dealoc coap session------------------------------------------------------------------
Aug 19 10:59:12 DEBG ***[fdde:ad00:beef:0:4522:75f4:9ee6:2fec]:54833 <-> [fdde:ad00:beef:0:f15:7fbd:731:c7d4]:5683 UDP : session closed

**Comment by mrdeep1** [comment]
Again, your server is violating RFC7252.  https://tools.ietf.org/html/rfc7252#section-4.4 

> An Acknowledgement or Reset message is related to a Confirmable
> message or Non-confirmable message by means of a Message ID along
> with additional address information of the corresponding endpoint.
> The Message ID is a 16-bit unsigned integer that is generated by the
> sender of a Confirmable or Non-confirmable message and included in
> the CoAP header.  The Message ID MUST be echoed in the
> Acknowledgement or Reset message by the recipient.

Your request

> Aug 19 10:58:35 DEBG * [fdde:ad00:beef:0:4522:75f4:9ee6:2fec]:53165 <-> [fdde:ad00:beef:0:f15:7fbd:731:c7d4]:5683 UDP : sent 15 bytes
> v:1 t:CON c:GET **i:0000** {} [ Uri-Path:read ] :: '\x03\x00\x00\x00\x8C'

With response

> Aug 19 10:58:35 DEBG * [fdde:ad00:beef:0:4522:75f4:9ee6:2fec]:53165 <-> [fdde:ad00:beef:0:f15:7fbd:731:c7d4]:5683 UDP : received 150 bytes
> v:1 t:ACK c:2.05 **i:8c00** {038c00} [ ] :: '\x03\x8C........

have different **i:** fields (which is the message id) - hence the client is unable to determine which sent packet the response was against, giving `sent `as NULL.  In the second example, there is not data being returned, but as **i:0000** is the same in the response, `sent `is set correctly.

Note that **`{038c00}`** in the bad response is the token field, but suspiciously looks like the message id **i:8c00**, but only 16 bits.  Furthermore the data in the initial request is  **'\x03\x00\x00\x00\x8C'** which when playing with little endian re-ordering (**\x03\x8C\x00\x00\x00**) could be read in hex as **038c00** - too many co-incidences here in the server code.

.

**Comment by fero29** [comment]
OK it is my fault. Thank you for help!

**Comment by fero29** [comment]
Is exist any way to access sent packet in multicast message?

**Comment by mrdeep1** [comment]
Your response packet matching design is fundamentally flawed if basing it off the `sent `PDU.  At the application layer, this should be done using TOKENs for both unicast and multicast.  Message IDs in of themselves are insufficient (see RFC7252 Figure 20).

As Multicast can only use non-confirmable, there is no record kept of the sent PDU as there will be no re-transmission timeouts done by the libcoap layer.

https://tools.ietf.org/html/rfc7252#section-4.4

> For an Acknowledgement or Reset message to match a Confirmable or
> Non-confirmable message, the Message ID and source endpoint of the
> Acknowledgement or Reset message MUST match the Message ID and
> destination endpoint of the Confirmable or Non-confirmable message.

Updated by https://tools.ietf.org/html/rfc7252#section-8.1

> A multicast request is characterized by being transported in a CoAP
> message that is addressed to an IP multicast address instead of a
> CoAP endpoint.  Such multicast requests MUST be Non-confirmable.

and https://tools.ietf.org/html/rfc7252#section-8.2

> When matching a response to a multicast request, only the token MUST
> match; the source endpoint of the response does not need to (and will
> not) be the same as the destination endpoint of the original request.

**Comment by fero29** [comment]
OK and what is best way to generate token and matching multicast messages?

**Comment by mrdeep1** [comment]
https://tools.ietf.org/html/rfc7252#section-5.3 and in particular https://tools.ietf.org/html/rfc7252#section-5.3.1

The token needs to be unique per request.

It is the responsibility of the multicast server to use the same token in the response.

**Comment by fero29** [comment]
https://tools.ietf.org/html/rfc7252#section-5.3.1
>  The client SHOULD generate tokens in such a way that tokens currently in use for a given source/destination endpoint pair are unique.

It means that token must be the same per pair client-server in the same request?

**Comment by mrdeep1** [comment]
So, you have a unicast client address, multicast server address (which will send back from a unicast address).  For this "pair", every request / response will have to have its own unique token until you are absolutely sure there will be no further responses to the request.

Every new request could use a (16 or better 32bit) Token that is incremented by 1

**Comment by fero29** [comment]
creating session---------------------------------------------------------------------
Aug 21 08:57:48 DEBG ***[::]:0 <-> [ff03::1]:5683 UDP : new outgoing session
add token
Aug 21 08:57:48 DEBG *  [::]:0 <-> [ff03::1]:5683 UDP : sent 14 bytes
v:1 t:CON c:GET i:4070 {a9d5ba43} [ Uri-Path:hello ]
Aug 21 08:57:48 DEBG ** [::]:0 <-> [ff03::1]:5683 UDP : tid=16496 added to retransmit queue (2156ms)
coap send rq_______________________
Aug 21 08:57:48 DEBG *  [::]:0 <-> [ff03::1]:5683 UDP : received 8 bytes
v:1 t:ACK c:2.05 i:4070 {a9d5ba43} [ ]
Aug 21 08:57:48 DEBG ** [::]:58982 <-> [fdde:ad00:beef:0:6289:7f79:ec67:86fc]:5683 UDP : tid=16496: removed
v:1 t:ACK c:2.05 i:4070 {a9d5ba43} [ ]
hello response handler
remote: fdde:ad00:beef:0:6289:7f79:ec67:86fc
valid pointer
coap run ret: 0____________________
Aug 21 08:57:48 DEBG *  [::]:58982 <-> [fdde:ad00:beef:0:6289:7f79:ec67:86fc]:5683 UDP : received 8 bytes
v:1 t:ACK c:2.05 i:4070 {a9d5ba43} [ ]
v:1 t:ACK c:2.05 i:4070 {a9d5ba43} [ ]
hello response handler
remote: fdde:ad00:beef:0:8f6e:2743:ab63:6613
invalid pointer to sent pdu
coap run ret: 0____________________
Aug 21 08:57:48 DEBG *  [::]:58982 <-> [fdde:ad00:beef:0:8f6e:2743:ab63:6613]:5683 UDP : received 8 bytes
v:1 t:ACK c:2.05 i:4070 {a9d5ba43} [ ]
v:1 t:ACK c:2.05 i:4070 {a9d5ba43} [ ]
hello response handler
remote: fdde:ad00:beef:0:2085:6d85:9038:53d3
invalid pointer to sent pdu
coap run ret: 0____________________
Aug 21 08:57:48 DEBG *  [::]:58982 <-> [fdde:ad00:beef:0:2085:6d85:9038:53d3]:5683 UDP : received 8 bytes
v:1 t:ACK c:2.05 i:4070 {a9d5ba43} [ ]
v:1 t:ACK c:2.05 i:4070 {a9d5ba43} [ ]
hello response handler
remote: fdde:ad00:beef:0:f15:7fbd:731:c7d4
invalid pointer to sent pdu
coap run ret: 0____________________
Aug 21 08:57:48 DEBG *  [::]:58982 <-> [fdde:ad00:beef:0:f15:7fbd:731:c7d4]:5683 UDP : received 8 bytes
v:1 t:ACK c:2.05 i:4070 {a9d5ba43} [ ]
v:1 t:ACK c:2.05 i:4070 {a9d5ba43} [ ]
hello response handler
remote: fdde:ad00:beef:0:4b7:a5d0:4e6a:7fc3
invalid pointer to sent pdu
coap run ret: 0____________________
coap run ret: 2000____________________
dealoc coap session------------------------------------------------------------------
Aug 21 08:57:50 DEBG ***[::]:58982 <-> [fdde:ad00:beef:0:4b7:a5d0:4e6a:7fc3]:5683 UDP : session closed




is this correct?

**Comment by fero29** [comment]
client generate the token and message ID and send NONCONFIRMABLE multicast message
servers send response wiht same token, same ID and response NONCONFIRMABLE unicast message

**Comment by fero29** [comment]
LOG OUTPUT:

creating session---------------------------------------------------------------------
Aug 21 10:24:27 DEBG ***[::]:0 <-> [ff03::1]:5683 UDP : new outgoing session
add token
Aug 21 10:24:27 DEBG *  [::]:0 <-> [ff03::1]:5683 UDP : sent 14 bytes
v:1 t:NON c:GET i:b4ca {e3b84dd7} [ Uri-Path:hello ]
coap send rq_______________________
Aug 21 10:24:27 DEBG *  [::]:0 <-> [ff03::1]:5683 UDP : received 8 bytes
v:1 t:NON c:2.05 i:b4ca {e3b84dd7} [ ]
v:1 t:NON c:2.05 i:b4ca {e3b84dd7} [ ]
hello response handler
remote: fdde:ad00:beef:0:8f6e:2743:ab63:6613
invalid pointer to sent pdu
coap run ret: 0____________________
Aug 21 10:24:27 DEBG *  [::]:60852 <-> [fdde:ad00:beef:0:8f6e:2743:ab63:6613]:5683 UDP : received 8 bytes
v:1 t:NON c:2.05 i:b4ca {e3b84dd7} [ ]
v:1 t:NON c:2.05 i:b4ca {e3b84dd7} [ ]
hello response handler
remote: fdde:ad00:beef:0:2085:6d85:9038:53d3
invalid pointer to sent pdu
coap run ret: 0____________________
Aug 21 10:24:27 DEBG *  [::]:60852 <-> [fdde:ad00:beef:0:2085:6d85:9038:53d3]:5683 UDP : received 8 bytes
v:1 t:NON c:2.05 i:b4ca {e3b84dd7} [ ]
v:1 t:NON c:2.05 i:b4ca {e3b84dd7} [ ]
hello response handler
remote: fdde:ad00:beef:0:6289:7f79:ec67:86fc
invalid pointer to sent pdu
coap run ret: 0____________________
Aug 21 10:24:27 DEBG *  [::]:60852 <-> [fdde:ad00:beef:0:6289:7f79:ec67:86fc]:5683 UDP : received 8 bytes
v:1 t:NON c:2.05 i:b4ca {e3b84dd7} [ ]
v:1 t:NON c:2.05 i:b4ca {e3b84dd7} [ ]
hello response handler
remote: fdde:ad00:beef:0:f15:7fbd:731:c7d4
invalid pointer to sent pdu
coap run ret: 0____________________
coap run ret: 2000____________________
dealoc coap session------------------------------------------------------------------
Aug 21 10:24:29 DEBG ***[::]:60852 <-> [fdde:ad00:beef:0:f15:7fbd:731:c7d4]:5683 UDP : session closed


listening on interface:


10:24:27.106434 IP6 fdde:ad00:beef:0:4522:75f4:9ee6:2fec.60852 > ff03::1.5683: UDP, length 14
10:24:27.117974 IP6 fdde:ad00:beef:0:8f6e:2743:ab63:6613.5683 > fdde:ad00:beef:0:4522:75f4:9ee6:2fec.60852: UDP, length 8
10:24:27.121885 IP6 fdde:ad00:beef:0:2085:6d85:9038:53d3.5683 > fdde:ad00:beef:0:4522:75f4:9ee6:2fec.60852: UDP, length 8
10:24:27.125790 IP6 fdde:ad00:beef:0:6289:7f79:ec67:86fc.5683 > fdde:ad00:beef:0:4522:75f4:9ee6:2fec.60852: UDP, length 8
10:24:27.131045 IP6 fdde:ad00:beef:0:f15:7fbd:731:c7d4.5683 > fdde:ad00:beef:0:4522:75f4:9ee6:2fec.60852: UDP, length 8

**Comment by mrdeep1** [comment]
In terms of sending the multicast request and getting the now unicast responses, everything looks to be ok in terms of request / response.

The timestamped log entry is the entry being logged before the src / dest addresses are getting updated in the session which could be tidied up at some point.

What is unclear is why the server sends back 4 responses from 4 different unicast addresses (as seen by your log and packet capture on the server).  Are these 4 different unicast addresses all valid addresses for the server device?

**Comment by fero29** [comment]
yes, there is 4 different servers

**Comment by mrdeep1** [comment]
Then everything looks fine to me (apart from the timestamped log entry referring to the previous src / dest address).

How you subsequently handle the N servers is down to your client application

**Comment by fero29** [comment]
and every response shout know SENT pdu?

**Comment by mrdeep1** [comment]
No.  I would not expect the `sent` field to be anything other than NULL.  As I previously stated :   

> As Multicast can only use non-confirmable, there is no record kept of the sent PDU as there will be no re-transmission timeouts done by the libcoap layer.

Further more, this is also true for unicast non-confirmable.  Using `sent `as a way of matching things is a fundamental design flaw.  The only safe match is the use of `Tokens`.
