### ISSUE TITLE
incorrect source address of multicast response

### ISSUE THREAD

**Issue by fero29** [obgm/libcoap#371]
When I send multicast message and I want to read address from who is the message, there is only broadcast address but no address of node who send response. 

I read address from session coap_address_t remote_addr.

am I doing it right? or is there such an address somewhere else?

**Comment by mrdeep1** [comment]
Are you using the develop branch that has fix #350 included (was merged 4 days ago https://github.com/obgm/libcoap/commit/27eec0c1c503d7f997a77ac21a3d69383499da81 , in particular the change to src/net.c)?
- That should now correctly update session->remote_addr

**Comment by fero29** [comment]
Okey thanks. And when I want to use this address it write : network IS unreachable

**Comment by mrdeep1** [comment]
I assume that you have verified that the IP address you are responding to is the same as that of the requesting client.

Then it looks like you have a routing issue/response packet is being sent out of the wrong interface

**Comment by fero29** [comment]
I send multicast packet, and when I get response, I read session->remote_addr and send packet to this address.

How to set interface to send message?

**Comment by fero29** [comment]
I try to use 7 nodes and from each I get this address: a00:1633::fdde:ad00:beef:0

**Comment by mrdeep1** [comment]
For the client,you specify the interface IP (and hence interface) using the -a option as in
````
Client

$ ifconfig ens192
ens192: flags=4163<UP,BROADCAST,RUNNING,MULTICAST>  mtu 1500
        inet 192.168.0.63  netmask 255.255.255.0  broadcast 192.168.0.255
        inet6 2001::63  prefixlen 96  scopeid 0x0<global>
        inet6 fe80::20c:29ff:fecf:a8f4  prefixlen 64  scopeid 0x20<link>
        ether 00:0c:29:cf:a8:f4  txqueuelen 1000  (Ethernet)
        RX packets 114798113  bytes 60240224183 (56.1 GiB)
        RX errors 0  dropped 10  overruns 0  frame 0
        TX packets 14837793  bytes 21578727247 (20.0 GiB)
        TX errors 0  dropped 0 overruns 0  carrier 0  collisions 0

$ coap-client -v9 -a 2001::63 coap://[ff02::fd]
Jul 03 10:09:49 DEBG ***[2001::63]:47059 <-> [ff02::fd]:5683 UDP : new outgoing session
Jul 03 10:09:49 DEBG sending CoAP request:
Jul 03 10:09:49 DEBG *  [2001::63]:47059 <-> [ff02::fd]:5683 UDP : sent 4 bytes
v:1 t:CON c:GET i:58a1 {} [ ]
Jul 03 10:09:49 DEBG ** [2001::63]:47059 <-> [ff02::fd]:5683 UDP : tid=22689 added to retransmit queue (2219ms)
Jul 03 10:09:49 DEBG timeout is set to 90 seconds
Jul 03 10:09:49 DEBG *  [2001::63]:47059 <-> [ff02::fd]:5683 UDP : received 151 bytes
v:1 t:ACK c:2.05 i:58a1 {} [ ETag:\x1A\xA7\xE9\x26, Content-Format:text/plain, Max-Age:196607 ] :: 'This is a test server made with libcoap (see https://libcoap.net)\x0ACopyright (C) 2010--2019 Olaf Bergmann <bergmann@tzi.org> and others\x0A\x0A'
Jul 03 10:09:49 DEBG ** [2001::63]:47059 <-> [2001::189]:5683 UDP : tid=22689: removed
Jul 03 10:09:49 DEBG ** process incoming 2.05 response:
This is a test server made with libcoap (see https://libcoap.net)
Copyright (C) 2010--2019 Olaf Bergmann <bergmann@tzi.org> and others

Jul 03 10:09:49 DEBG ***[2001::63]:47059 <-> [2001::189]:5683 UDP : session closed

Server

$ ifconfig eth0
eth0      Link encap:Ethernet  HWaddr 00:0C:29:9A:7B:BA  
          inet addr:192.168.0.189  Bcast:192.168.0.255  Mask:255.255.255.0
          inet6 addr: 2001::189/96 Scope:Global
          inet6 addr: fe80::20c:29ff:fe9a:7bba/64 Scope:Link
          UP BROADCAST RUNNING MULTICAST  MTU:1500  Metric:1
          RX packets:118337198 errors:0 dropped:0 overruns:0 frame:0
          TX packets:188746899 errors:0 dropped:0 overruns:0 carrier:0
          collisions:0 txqueuelen:10000 
          RX bytes:42957159708 (40.0 GiB)  TX bytes:189902545686 (176.8 GiB)
]
$ coap-server -g FF02::FD -v9
Jul 03 10:09:28 DEBG (D)TLS not enabled as neither -k or -c options specified
Jul 03 10:09:28 DEBG created UDP  endpoint [::]:5683
Jul 03 10:09:28 DEBG created TCP  endpoint [::]:5683
Jul 03 10:09:49 DEBG ***[ff02::fd]:5683 <-> [2001::63]:47059 (if2) UDP : new incoming session
Jul 03 10:09:49 DEBG *  [ff02::fd]:5683 <-> [2001::63]:47059 (if2) UDP : received 4 bytes
v:1 t:CON c:GET i:58a1 {} [ ]
Jul 03 10:09:49 DEBG call custom handler for resource ''
Jul 03 10:09:49 DEBG *  [ff02::fd]:5683 <-> [2001::63]:47059 (if2) UDP : sent 151 bytes
v:1 t:ACK c:2.05 i:58a1 {} [ ETag:\x1A\xA7\xE9\x26, Content-Format:text/plain, Max-Age:196607 ] :: 'This is a test server made with libcoap (see https://libcoap.net)\x0ACopyright (C) 2010--2019 Olaf Bergmann <bergmann@tzi.org> and others\x0A\x0A'
````

**Comment by fero29** [comment]
Ok, but I´m using libcoap in C++ code based on libcoap-minimal example. 
My program sending multicast message to all nodes and I want to create list of nodes addressess. When I´m send multicast  message then in all responses is the same address. before this fix #350 it was be "ff03::1". 
Now it is "a00:1633::fdde:ad00:beef:0" but still all responses from diferent nodes have in session-> remote_addr the same address.

**Comment by mrdeep1** [comment]
Add this line of code into your client and see what the reported session IPs are
````
coap_dtls_set_log_level(LOG_DEBUG);
````
after the `coap_startup();` line.
Your reported address looks like it is not correctly being written out.

**Comment by fero29** [comment]
iam add line and next? i think i dont understand this.

**Comment by mrdeep1** [comment]
Add in the line in your code in the correct place
Recompile your code
Run your client again
Look at the additional debug output generated and see the local / remote addresses for each packet.

**Comment by fero29** [comment]
when it start response handler from some node it print addr 

this is how to create and print address string:

    char remoteaddr[INET6_ADDRSTRLEN], locaddr [INET6_ADDRSTRLEN];
    inet_ntop(AF_INET6,  &(session->remote_addr.addr.sin6), remoteaddr, INET6_ADDRSTRLEN);
    inet_ntop(AF_INET6,  &(session->local_addr.addr.sin6), locaddr, INET6_ADDRSTRLEN);
    printf("remote: %s\n\rlocal: %s\n\r", remoteaddr, locaddr);


this is output comunicating with 3 diferent nodes:

Starting libcoap client
coap send multicast hello rq 

coap hello rq handler 
remote: a00:1633::fdde:ad00:beef:0
local: a00:d7cd::
coap run ret: 0    //no error

coap hello rq handler
remote: a00:1633::fdde:ad00:beef:0
local: a00:d7cd::
coap run ret: 0

coap hello rq handler
remote: a00:1633::fdde:ad00:beef:0
local: a00:d7cd::
coap run ret: 1000  //timeout I use it for read responses from multicast

**Comment by mrdeep1** [comment]
Your code looks like it should work - however the `coap_session_t` structure for `session `may be complied differently in libcoap and your application so that the variable offsets are different and hence the same IP (likely bad) addresses getting reported

I strongly suggest that you increase the libcoap logging level as suggested to check that your application is not picking up a different set of #include header files to that used for the libcoap build by looking at what libcoap thinks the library addresses are.

Furthermore, when running a packet capture on the network interface what addresses are shown for the traffic to/from port 5683.

**Comment by fero29** [comment]
there is packet capture 
13:10:51.486929 IP6 fdde:ad00:beef:0:7062:f7fa:2edd:b814.48549 > ff03::1.5683: UDP, length 10

13:10:51.512133 IP6 fdde:ad00:beef:0:9ee7:a88c:22a5:f1b7.5683 > fdde:ad00:beef:0:7062:f7fa:2edd:b814.48549: UDP, length 21

13:10:51.512389 IP6 fdde:ad00:beef:0:7062:f7fa:2edd:b814.48549 > fdde:ad00:beef:0:9ee7:a88c:22a5:f1b7.5683: UDP, length 4

13:10:51.518126 IP6 fdde:ad00:beef:0:de30:504e:274a:39d1.5683 > fdde:ad00:beef:0:7062:f7fa:2edd:b814.48549: UDP, length 4

13:10:51.518236 IP6 fdde:ad00:beef:0:7062:f7fa:2edd:b814.48549 > fdde:ad00:beef:0:de30:504e:274a:39d1.5683: UDP, length 4

13:10:51.524045 IP6 fdde:ad00:beef:0:d764:fa61:2368:5368.5683 > fdde:ad00:beef:0:7062:f7fa:2edd:b814.48549: UDP, length 4

13:10:51.524146 IP6 fdde:ad00:beef:0:7062:f7fa:2edd:b814.48549 > fdde:ad00:beef:0:d764:fa61:2368:5368.5683: UDP, length 4

**Comment by fero29** [comment]
it remotely run on Raspberry pi and yesterday I download newest git libcoap-develop and folow instructions to install it

**Comment by mrdeep1** [comment]
OK - there is a mismatch in the application reported addresses compared to the packet capture a #nd I suspect that libcoap would report the same (if you enabled debug logging as I suggested) as the packet capture in your client application.

remote: a00:1633::fdde:ad00:beef:0
local: a00:d7cd::

13:10:51.486929 IP6 **fdde:ad00:beef:0:7062:f7fa:2edd:b814**.48549 > ff03::1.5683: UDP, length 1

The client's IP address is **fdde:ad00:beef:0**:7062:f7fa:2edd:b814
Port 5683 is **1633** in hex.
Note that for the remote address you have
remote: a00:**1633**::fdde:ad00:beef:0
remote: a00:1633::**fdde:ad00:beef:0**
which comprises of the port followed by the first part of the local address.

You are printing out the wrong offsets out of coap_session_t - libcoap and your application are using different #include files.

**Comment by fero29** [comment]
I check include directories and libs and I think its ok
/usr/local/include    - there is directory coap2 which is since 2.7. -when I´m git and install newest libcoap-dev
/usr/local/lib -there is libs libcoap-2 and pkgconfig since 2.7.

is it any another place to check?

**Comment by fero29** [comment]
How I enable debug loging? 
i´m added command that you are suggested that´s all?

there is part of code:

coap_startup();
coap_dtls_set_log_level(LOG_DEBUG);
printf("creating client\n\r");_

**Comment by mrdeep1** [comment]
In your source files, do you have
#include <coap**2**/coap.h>
or
#include <coap/coap.h>

The latter is the wrong one - libcoap-minimal was updated 23 days ago to correct this to use coap**2**.

In terms of debugging - my mistake - you also need to include the line

coap_set_log_level(log_level);

The one I previously provided enables debug logging at the DTLS level - sorry.

**Comment by fero29** [comment]
in sources is :
#include <coap2/coap.h>

**Comment by fero29** [comment]
creating client
Jul 04 08:59:50 DEBG ***[::]:0 <-> [ff03::1]:5683 UDP : new outgoing session
Starting libcoap client
Jul 04 08:59:50 DEBG *  [::]:0 <-> [ff03::1]:5683 UDP : sent 10 bytes
v:1 t:CON c:GET i:0000 {} [ Uri-Path:hello ]
Jul 04 08:59:50 DEBG ** [::]:0 <-> [ff03::1]:5683 UDP : tid=0 added to retransmit queue (2406ms)
coap send hello rq 
Jul 04 08:59:50 DEBG *  [::]:0 <-> [ff03::1]:5683 UDP : received 21 bytes
v:1 t:CON c:2.05 i:e5bb {} [ ] :: '\xFE\x80\x00\x00\x00\x00\x00\x00\xFC\xD1\xEB7\xE1$ R'
Jul 04 08:59:50 DEBG *  [::]:35375 <-> [fdde:ad00:beef:0:1ba6:bbe3:d606:b556]:5683 UDP : sent 4 bytes
v:1 t:ACK c:0.00 i:e5bb {} [ ]
Jul 04 08:59:50 DEBG ** [::]:35375 <-> [fdde:ad00:beef:0:1ba6:bbe3:d606:b556]:5683 UDP : tid=0: removed
hello response handler
remote: a00:1633::fdde:ad00:beef:0
local: a00:8a2f::
coap run ret: 0
coap run ret: 1000
Jul 04 08:59:51 DEBG ***[::]:35375 <-> [fdde:ad00:beef:0:1ba6:bbe3:d606:b556]:5683 UDP : session closed

**Comment by mrdeep1** [comment]
OK - that #include is good.  the debug logging ties up with your packet capture - which makes sense.

I see your issue
`inet_ntop(AF_INET6,  &(session->remote_addr.addr.sin6), remoteaddr, INET6_ADDRSTRLEN);` should really be
`inet_ntop(AF_INET6,  &(session->remote_addr.addr.sin6.sin6_addr), remoteaddr, INET6_ADDRSTRLEN);
`

**Comment by fero29** [comment]
ok. thank you very much! now its ok

**Comment by mrdeep1** [comment]
Great.  Please close this issue as it is now resolved.
